{
  "bestatt": true,
  "etterkontroll": {
    "digest_likhet": true,
    "drillet_livslop": "draining",
    "kandidat_livslop": "claiming",
    "modulstatus": "aktiv",
    "rullback_bytes_er_forgjengerens": true,
    "rullback_livslop": "draining",
    "unit_override_fjernet": true
  },
  "identiteter": {
    "inflight_oppdrag_id": "136",
    "kandidat_oppdrag_id": "138",
    "probe_oppdrag_id": "135",
    "rullback_oppdrag_id": "137"
  },
  "krav_id": "m23-rollback-v1",
  "maalt": {
    "claims_etter_drenering": 0,
    "falske_verdikter": 0,
    "inflight_har_signert_kvittering": true,
    "inflight_oppdrag": 1,
    "inflight_utfall": "utfort",
    "kandidat_claimet_oppdrag": 1,
    "kandidat_har_signert_kvittering": true,
    "overtakelse_s": 1.0,
    "release_digest_bundet": true,
    "rullback_claimet_oppdrag": 1,
    "rullback_har_signert_kvittering": true,
    "rullback_overtakelse_s": 1.0,
    "rullback_promoterte": 0,
    "ventetid_ubehandlet_s": 25.0
  },
  "oppsett": {
    "drillet_digest": "55d7b1243443ae8d47e9c597fd5c0c076735b521516065032b706f8bc5781038",
    "drillet_katalog": "/opt/disponit/releases/f0486382c8debdb9a6b32c9a30ef912aa26f0df4",
    "drillet_release": "m23-r3-f0486382",
    "forgjenger_digest": "55d7b1243443ae8d47e9c597fd5c0c076735b521516065032b706f8bc5781038",
    "forgjenger_katalog": "/opt/disponit/releases/98a62a09c436bef6778cbc333b428c252dea8e21",
    "forgjenger_release": "m23-r2-98a62a09",
    "kandidat_digest": "55d7b1243443ae8d47e9c597fd5c0c076735b521516065032b706f8bc5781038",
    "kandidat_release": "m23-drill-k-20260917T130007",
    "kontrakt_hash": "7ce6d89a25bd57e5b425be33435e74dfb8c476d9aceea417baee7049ed80fd48",
    "kontraktversjon": 1,
    "miljo": "staging",
    "modul": "m23_fordring",
    "module_epoch": 0,
    "rullback_digest": "55d7b1243443ae8d47e9c597fd5c0c076735b521516065032b706f8bc5781038",
    "rullback_release": "m23-drill-rb-20260917T130007",
    "tenant": "t-m23drill-9eea19",
    "vert": "disponit-srv"
  },
  "ts": "2026-09-17T13:01:04.244263+00:00"
}
